"No.","Time","Source","Destination","Protocol","Length","Info"
"1","0.000000000","10.0.0.2","224.0.0.251","MDNS","78","Standard query 0x0000  PTR _privet._tcp.local, ""QM"" question"
"2","0.005824000","10.0.0.2","224.0.0.22","IGMPv3","54","Membership Report / Join group 224.0.0.251 for any sources"
"3","0.293056000","10.0.0.2","224.0.0.22","IGMPv3","54","Membership Report / Join group 224.0.0.251 for any sources"
"4","0.842526000","10.0.0.2","10.0.0.1","TCP","74","34444 > irdmi [SYN] Seq=0 Win=29200 Len=0 MSS=1460 SACK_PERM=1 TSval=276241 TSecr=0 WS=512"
"5","0.843501000","10.0.0.2","10.0.0.1","TCP","74","34446 > irdmi [SYN] Seq=0 Win=29200 Len=0 MSS=1460 SACK_PERM=1 TSval=276241 TSecr=0 WS=512"
"6","0.843510000","10.0.0.2","10.0.0.1","TCP","74","34448 > irdmi [SYN] Seq=0 Win=29200 Len=0 MSS=1460 SACK_PERM=1 TSval=276241 TSecr=0 WS=512"
"7","0.893304000","10.0.0.1","10.0.0.2","TCP","74","irdmi > 34444 [SYN, ACK] Seq=0 Ack=1 Win=28960 Len=0 MSS=1460 SACK_PERM=1 TSval=276266 TSecr=276241 WS=512"
"8","0.894275000","10.0.0.1","10.0.0.2","TCP","74","irdmi > 34446 [SYN, ACK] Seq=0 Ack=1 Win=28960 Len=0 MSS=1460 SACK_PERM=1 TSval=276267 TSecr=276241 WS=512"
"9","0.894278000","10.0.0.1","10.0.0.2","TCP","74","irdmi > 34448 [SYN, ACK] Seq=0 Ack=1 Win=28960 Len=0 MSS=1460 SACK_PERM=1 TSval=276267 TSecr=276241 WS=512"
"10","0.997543000","10.0.0.2","224.0.0.251","MDNS","78","Standard query 0x0000  PTR _privet._tcp.local, ""QM"" question"
"11","1.045355000","10.0.0.2","10.0.0.1","TCP","66","34444 > irdmi [ACK] Seq=1 Ack=1 Win=29696 Len=0 TSval=276292 TSecr=276266"
"12","1.045522000","10.0.0.2","10.0.0.1","HTTP","466","GET / HTTP/1.1 "
"13","1.046462000","10.0.0.2","10.0.0.1","TCP","66","34446 > irdmi [ACK] Seq=1 Ack=1 Win=29696 Len=0 TSval=276292 TSecr=276267"
"14","1.047440000","10.0.0.2","10.0.0.1","TCP","66","34448 > irdmi [ACK] Seq=1 Ack=1 Win=29696 Len=0 TSval=276292 TSecr=276267"
"15","1.095768000","10.0.0.1","10.0.0.2","TCP","66","irdmi > 34444 [ACK] Seq=1 Ack=401 Win=30208 Len=0 TSval=276317 TSecr=276292"
"16","1.097232000","10.0.0.1","10.0.0.2","TCP","83","[TCP segment of a reassembled PDU]"
"17","1.097239000","10.0.0.1","10.0.0.2","TCP","1514","[TCP segment of a reassembled PDU]"
"18","1.097241000","10.0.0.1","10.0.0.2","HTTP","882","HTTP/1.0 200 OK  (text/html)"
"19","1.251264000","10.0.0.2","10.0.0.1","TCP","66","34444 > irdmi [ACK] Seq=401 Ack=18 Win=29696 Len=0 TSval=276343 TSecr=276317"
"20","1.251266000","10.0.0.2","10.0.0.1","TCP","66","34444 > irdmi [ACK] Seq=401 Ack=1466 Win=32256 Len=0 TSval=276343 TSecr=276317"
"21","1.275424000","10.0.0.2","10.0.0.1","TCP","66","34444 > irdmi [FIN, ACK] Seq=401 Ack=2283 Win=35328 Len=0 TSval=276349 TSecr=276317"
"22","1.326050000","10.0.0.1","10.0.0.2","TCP","66","irdmi > 34444 [ACK] Seq=2283 Ack=402 Win=30208 Len=0 TSval=276375 TSecr=276349"
"23","1.425095000","10.0.0.2","10.0.0.1","HTTP","433","GET /favicon.ico HTTP/1.1 "
"24","1.475958000","10.0.0.1","10.0.0.2","TCP","66","irdmi > 34446 [ACK] Seq=1 Ack=368 Win=30208 Len=0 TSval=276412 TSecr=276387"
"25","1.476468000","10.0.0.1","10.0.0.2","TCP","95","[TCP segment of a reassembled PDU]"
"26","1.476470000","10.0.0.1","10.0.0.2","HTTP","381","HTTP/1.0 404 File not found  (text/html)"
"27","1.627581000","10.0.0.2","10.0.0.1","TCP","66","34446 > irdmi [ACK] Seq=368 Ack=30 Win=29696 Len=0 TSval=276438 TSecr=276412"
"28","1.628690000","10.0.0.2","10.0.0.1","TCP","66","34446 > irdmi [FIN, ACK] Seq=368 Ack=346 Win=32256 Len=0 TSval=276438 TSecr=276412"
"29","1.678777000","10.0.0.1","10.0.0.2","TCP","66","irdmi > 34446 [ACK] Seq=346 Ack=369 Win=30208 Len=0 TSval=276463 TSecr=276438"
"30","2.908888000","10.0.0.2","10.0.0.1","HTTP","678","GET /Course%20Outlines%20-%20Electrical%20and%20Computer%20Engineering%20-%20Faculty%20of%20Engineering%20-%20Western%20University.html HTTP/1.1 "
"31","2.959105000","10.0.0.1","10.0.0.2","TCP","66","irdmi > 34448 [ACK] Seq=1 Ack=613 Win=32256 Len=0 TSval=276783 TSecr=276758"
"32","2.960004000","10.0.0.1","10.0.0.2","TCP","83","[TCP segment of a reassembled PDU]"
"33","2.960007000","10.0.0.1","10.0.0.2","TCP","2962","[TCP segment of a reassembled PDU]"
"34","2.972352000","10.0.0.1","10.0.0.2","TCP","2962","[TCP segment of a reassembled PDU]"
"35","2.996394000","10.0.0.1","10.0.0.2","TCP","1514","[TCP segment of a reassembled PDU]"
"36","2.998206000","10.0.0.2","224.0.0.251","MDNS","78","Standard query 0x0000  PTR _privet._tcp.local, ""QM"" question"
"37","3.008636000","10.0.0.1","10.0.0.2","TCP","2962","[TCP segment of a reassembled PDU]"
"38","3.032680000","10.0.0.1","10.0.0.2","TCP","2962","[TCP segment of a reassembled PDU]"
"39","3.110268000","10.0.0.2","10.0.0.1","TCP","66","34448 > irdmi [ACK] Seq=613 Ack=18 Win=29696 Len=0 TSval=276808 TSecr=276783"
"40","3.110270000","10.0.0.2","10.0.0.1","TCP","66","34448 > irdmi [ACK] Seq=613 Ack=2914 Win=35328 Len=0 TSval=276808 TSecr=276783"
"41","3.123234000","10.0.0.2","10.0.0.1","TCP","66","34448 > irdmi [ACK] Seq=613 Ack=5810 Win=40960 Len=0 TSval=276811 TSecr=276783"
"42","3.147309000","10.0.0.2","10.0.0.1","TCP","66","34448 > irdmi [ACK] Seq=613 Ack=7258 Win=44032 Len=0 TSval=276817 TSecr=276783"
"43","3.160287000","10.0.0.2","10.0.0.1","TCP","66","34448 > irdmi [ACK] Seq=613 Ack=10154 Win=49664 Len=0 TSval=276821 TSecr=276783"
"44","3.161263000","10.0.0.1","10.0.0.2","TCP","2962","[TCP segment of a reassembled PDU]"
"45","3.173696000","10.0.0.1","10.0.0.2","TCP","2962","[TCP segment of a reassembled PDU]"
"46","3.183714000","10.0.0.2","10.0.0.1","TCP","66","34448 > irdmi [ACK] Seq=613 Ack=13050 Win=55296 Len=0 TSval=276827 TSecr=276783"
"47","3.193471000","10.0.0.2","10.0.0.1","TCP","74","34450 > irdmi [SYN] Seq=0 Win=29200 Len=0 MSS=1460 SACK_PERM=1 TSval=276829 TSecr=0 WS=512"
"48","3.194448000","10.0.0.2","10.0.0.1","TCP","74","34452 > irdmi [SYN] Seq=0 Win=29200 Len=0 MSS=1460 SACK_PERM=1 TSval=276829 TSecr=0 WS=512"
"49","3.197376000","10.0.0.1","10.0.0.2","TCP","2962","[TCP segment of a reassembled PDU]"
"50","3.200205000","10.0.0.2","10.0.0.1","TCP","74","34454 > irdmi [SYN] Seq=0 Win=29200 Len=0 MSS=1460 SACK_PERM=1 TSval=276831 TSecr=0 WS=512"
"51","3.201816000","10.0.0.2","10.0.0.1","TCP","74","34456 > irdmi [SYN] Seq=0 Win=29200 Len=0 MSS=1460 SACK_PERM=1 TSval=276831 TSecr=0 WS=512"
"52","3.221809000","10.0.0.1","10.0.0.2","TCP","2962","[TCP segment of a reassembled PDU]"
"53","3.246201000","10.0.0.1","10.0.0.2","TCP","2962","[TCP segment of a reassembled PDU]"
"54","3.269632000","10.0.0.1","10.0.0.2","TCP","2962","[TCP segment of a reassembled PDU]"
"55","3.293870000","10.0.0.1","10.0.0.2","TCP","2962","[TCP segment of a reassembled PDU]"
"56","3.312010000","10.0.0.2","10.0.0.1","TCP","66","34448 > irdmi [ACK] Seq=613 Ack=15946 Win=61440 Len=0 TSval=276859 TSecr=276833"
"57","3.318234000","10.0.0.1","10.0.0.2","TCP","2962","[TCP segment of a reassembled PDU]"
"58","3.324304000","10.0.0.2","10.0.0.1","TCP","66","34448 > irdmi [ACK] Seq=613 Ack=18842 Win=67072 Len=0 TSval=276862 TSecr=276833"
"59","3.342614000","10.0.0.1","10.0.0.2","TCP","2962","[TCP segment of a reassembled PDU]"
"60","3.348795000","10.0.0.2","10.0.0.1","TCP","66","34448 > irdmi [ACK] Seq=613 Ack=21738 Win=72704 Len=0 TSval=276868 TSecr=276833"
"61","3.366586000","10.0.0.1","10.0.0.2","TCP","2962","[TCP segment of a reassembled PDU]"
"62","3.373540000","10.0.0.2","10.0.0.1","TCP","66","34448 > irdmi [ACK] Seq=613 Ack=24634 Win=78848 Len=0 TSval=276874 TSecr=276837"
"63","3.390879000","10.0.0.1","10.0.0.2","TCP","74","irdmi > 34450 [SYN, ACK] Seq=0 Ack=1 Win=28960 Len=0 MSS=1460 SACK_PERM=1 TSval=276854 TSecr=276829 WS=512"
"64","3.391749000","10.0.0.1","10.0.0.2","TCP","74","irdmi > 34452 [SYN, ACK] Seq=0 Ack=1 Win=28960 Len=0 MSS=1460 SACK_PERM=1 TSval=276854 TSecr=276829 WS=512"
"65","3.392221000","10.0.0.1","10.0.0.2","TCP","74","irdmi > 34454 [SYN, ACK] Seq=0 Ack=1 Win=28960 Len=0 MSS=1460 SACK_PERM=1 TSval=276856 TSecr=276831 WS=512"
"66","3.393196000","10.0.0.1","10.0.0.2","TCP","74","irdmi > 34456 [SYN, ACK] Seq=0 Ack=1 Win=28960 Len=0 MSS=1460 SACK_PERM=1 TSval=276856 TSecr=276831 WS=512"
"67","3.393199000","10.0.0.1","10.0.0.2","TCP","2962","[TCP segment of a reassembled PDU]"
"68","3.396808000","10.0.0.2","10.0.0.1","TCP","66","34448 > irdmi [ACK] Seq=613 Ack=27530 Win=84480 Len=0 TSval=276880 TSecr=276837"
"69","3.418119000","10.0.0.1","10.0.0.2","TCP","2962","[TCP segment of a reassembled PDU]"
"70","3.420275000","10.0.0.2","10.0.0.1","TCP","66","34448 > irdmi [ACK] Seq=613 Ack=30426 Win=90112 Len=0 TSval=276886 TSecr=276843"
"71","3.441675000","10.0.0.1","10.0.0.2","HTTP","81","HTTP/1.0 200 OK  (text/html)"
"72","3.444976000","10.0.0.2","10.0.0.1","TCP","66","34448 > irdmi [ACK] Seq=613 Ack=33322 Win=96256 Len=0 TSval=276892 TSecr=276846"
"73","3.468954000","10.0.0.2","10.0.0.1","TCP","66","34448 > irdmi [ACK] Seq=613 Ack=36218 Win=101888 Len=0 TSval=276898 TSecr=276846"
"74","3.493835000","10.0.0.2","10.0.0.1","TCP","66","34448 > irdmi [ACK] Seq=613 Ack=39114 Win=107520 Len=0 TSval=276904 TSecr=276852"
"75","3.517453000","10.0.0.2","10.0.0.1","TCP","66","34448 > irdmi [ACK] Seq=613 Ack=42010 Win=113664 Len=0 TSval=276910 TSecr=276852"
"76","3.541998000","10.0.0.2","10.0.0.1","TCP","66","34450 > irdmi [ACK] Seq=1 Ack=1 Win=29696 Len=0 TSval=276916 TSecr=276854"
"77","3.542920000","10.0.0.2","10.0.0.1","HTTP","683","GET /Course%20Outlines%20-%20Electrical%20and%20Computer%20Engineering%20-%20Faculty%20of%20Engineering%20-%20Western%20University_files/style-responsive.css HTTP/1.1 "
"78","3.543197000","10.0.0.2","10.0.0.1","TCP","66","34452 > irdmi [ACK] Seq=1 Ack=1 Win=29696 Len=0 TSval=276916 TSecr=276854"
"79","3.543210000","10.0.0.2","10.0.0.1","HTTP","680","GET /Course%20Outlines%20-%20Electrical%20and%20Computer%20Engineering%20-%20Faculty%20of%20Engineering%20-%20Western%20University_files/standard-menu.css HTTP/1.1 "
"80","3.544174000","10.0.0.2","10.0.0.1","TCP","66","34454 > irdmi [ACK] Seq=1 Ack=1 Win=29696 Len=0 TSval=276917 TSecr=276856"
"81","3.544175000","10.0.0.2","10.0.0.1","HTTP","676","GET /Course%20Outlines%20-%20Electrical%20and%20Computer%20Engineering%20-%20Faculty%20of%20Engineering%20-%20Western%20University_files/1.6.4.jquery.min.js.download HTTP/1.1 "
"82","3.547796000","10.0.0.2","10.0.0.1","TCP","66","34448 > irdmi [ACK] Seq=613 Ack=44906 Win=119296 Len=0 TSval=276917 TSecr=276884"
"83","3.568609000","10.0.0.2","10.0.0.1","TCP","66","34456 > irdmi [ACK] Seq=1 Ack=1 Win=29696 Len=0 TSval=276923 TSecr=276856"
"84","3.568611000","10.0.0.2","10.0.0.1","HTTP","676","GET /Course%20Outlines%20-%20Electrical%20and%20Computer%20Engineering%20-%20Faculty%20of%20Engineering%20-%20Western%20University_files/rbn-standardpage.js.download HTTP/1.1 "
"85","3.568612000","10.0.0.2","10.0.0.1","TCP","66","34448 > irdmi [ACK] Seq=613 Ack=47802 Win=124928 Len=0 TSval=276923 TSecr=276884"
"86","3.592352000","10.0.0.2","10.0.0.1","TCP","66","34448 > irdmi [FIN, ACK] Seq=613 Ack=47818 Win=124928 Len=0 TSval=276929 TSecr=276884"
"87","3.592983000","10.0.0.1","10.0.0.2","TCP","66","irdmi > 34450 [ACK] Seq=1 Ack=618 Win=32256 Len=0 TSval=276942 TSecr=276916"
"88","3.593333000","10.0.0.1","10.0.0.2","TCP","66","irdmi > 34452 [ACK] Seq=1 Ack=615 Win=32256 Len=0 TSval=276942 TSecr=276916"
"89","3.594216000","10.0.0.1","10.0.0.2","TCP","66","irdmi > 34454 [ACK] Seq=1 Ack=611 Win=32256 Len=0 TSval=276942 TSecr=276917"
"90","3.594221000","10.0.0.1","10.0.0.2","TCP","95","[TCP segment of a reassembled PDU]"
"91","3.594481000","10.0.0.1","10.0.0.2","HTTP","381","HTTP/1.0 404 File not found  (text/html)"
"92","3.595977000","10.0.0.1","10.0.0.2","TCP","95","[TCP segment of a reassembled PDU]"
"93","3.596055000","10.0.0.1","10.0.0.2","HTTP","381","HTTP/1.0 404 File not found  (text/html)"
"94","3.597918000","10.0.0.1","10.0.0.2","TCP","95","[TCP segment of a reassembled PDU]"
"95","3.597922000","10.0.0.1","10.0.0.2","HTTP","381","HTTP/1.0 404 File not found  (text/html)"
"96","3.619402000","10.0.0.1","10.0.0.2","TCP","66","irdmi > 34456 [ACK] Seq=1 Ack=611 Win=32256 Len=0 TSval=276948 TSecr=276923"
"97","3.620335000","10.0.0.1","10.0.0.2","TCP","95","[TCP segment of a reassembled PDU]"
"98","3.620338000","10.0.0.1","10.0.0.2","HTTP","381","HTTP/1.0 404 File not found  (text/html)"
"99","3.642411000","10.0.0.1","10.0.0.2","TCP","66","irdmi > 34448 [ACK] Seq=47818 Ack=614 Win=32256 Len=0 TSval=276954 TSecr=276929"
"100","3.744896000","10.0.0.2","10.0.0.1","TCP","66","34450 > irdmi [ACK] Seq=618 Ack=30 Win=29696 Len=0 TSval=276967 TSecr=276942"
"101","3.746090000","10.0.0.2","10.0.0.1","TCP","66","34450 > irdmi [FIN, ACK] Seq=618 Ack=346 Win=32256 Len=0 TSval=276967 TSecr=276942"
"102","3.746722000","10.0.0.2","10.0.0.1","TCP","66","34452 > irdmi [ACK] Seq=615 Ack=30 Win=29696 Len=0 TSval=276967 TSecr=276942"
"103","3.748228000","10.0.0.2","10.0.0.1","TCP","66","34452 > irdmi [FIN, ACK] Seq=615 Ack=346 Win=32256 Len=0 TSval=276968 TSecr=276942"
"104","3.749210000","10.0.0.2","10.0.0.1","TCP","66","34454 > irdmi [ACK] Seq=611 Ack=30 Win=29696 Len=0 TSval=276968 TSecr=276943"
"105","3.750742000","10.0.0.2","10.0.0.1","TCP","66","34454 > irdmi [FIN, ACK] Seq=611 Ack=346 Win=32256 Len=0 TSval=276968 TSecr=276943"
"106","3.758006000","10.0.0.2","10.0.0.1","TCP","74","34462 > irdmi [SYN] Seq=0 Win=29200 Len=0 MSS=1460 SACK_PERM=1 TSval=276970 TSecr=0 WS=512"
"107","3.758557000","10.0.0.2","10.0.0.1","TCP","74","34460 > irdmi [SYN] Seq=0 Win=29200 Len=0 MSS=1460 SACK_PERM=1 TSval=276970 TSecr=0 WS=512"
"108","3.759259000","10.0.0.2","10.0.0.1","TCP","74","34464 > irdmi [SYN] Seq=0 Win=29200 Len=0 MSS=1460 SACK_PERM=1 TSval=276970 TSecr=0 WS=512"
"109","3.759814000","10.0.0.2","10.0.0.1","TCP","74","34458 > irdmi [SYN] Seq=0 Win=29200 Len=0 MSS=1460 SACK_PERM=1 TSval=276970 TSecr=0 WS=512"
"110","3.761891000","10.0.0.2","10.0.0.1","TCP","74","34466 > irdmi [SYN] Seq=0 Win=29200 Len=0 MSS=1460 SACK_PERM=1 TSval=276970 TSecr=0 WS=512"
"111","3.770684000","10.0.0.2","10.0.0.1","TCP","66","34456 > irdmi [ACK] Seq=611 Ack=30 Win=29696 Len=0 TSval=276973 TSecr=276948"
"112","3.775575000","10.0.0.2","10.0.0.1","TCP","66","34456 > irdmi [FIN, ACK] Seq=611 Ack=346 Win=32256 Len=0 TSval=276974 TSecr=276948"
"113","3.776555000","10.0.0.2","10.0.0.1","TCP","74","34468 > irdmi [SYN] Seq=0 Win=29200 Len=0 MSS=1460 SACK_PERM=1 TSval=276975 TSecr=0 WS=512"
"114","3.796230000","10.0.0.1","10.0.0.2","TCP","66","irdmi > 34450 [ACK] Seq=346 Ack=619 Win=32256 Len=0 TSval=276992 TSecr=276967"
"115","3.799005000","10.0.0.1","10.0.0.2","TCP","66","irdmi > 34452 [ACK] Seq=346 Ack=616 Win=32256 Len=0 TSval=276993 TSecr=276968"
"116","3.800937000","10.0.0.1","10.0.0.2","TCP","66","irdmi > 34454 [ACK] Seq=346 Ack=612 Win=32256 Len=0 TSval=276994 TSecr=276968"
"117","3.808296000","10.0.0.1","10.0.0.2","TCP","74","irdmi > 34462 [SYN, ACK] Seq=0 Ack=1 Win=28960 Len=0 MSS=1460 SACK_PERM=1 TSval=276995 TSecr=276970 WS=512"
"118","3.808760000","10.0.0.1","10.0.0.2","TCP","74","irdmi > 34460 [SYN, ACK] Seq=0 Ack=1 Win=28960 Len=0 MSS=1460 SACK_PERM=1 TSval=276995 TSecr=276970 WS=512"
"119","3.809736000","10.0.0.1","10.0.0.2","TCP","74","irdmi > 34464 [SYN, ACK] Seq=0 Ack=1 Win=28960 Len=0 MSS=1460 SACK_PERM=1 TSval=276996 TSecr=276970 WS=512"
"120","3.810718000","10.0.0.1","10.0.0.2","TCP","74","irdmi > 34458 [SYN, ACK] Seq=0 Ack=1 Win=28960 Len=0 MSS=1460 SACK_PERM=1 TSval=276996 TSecr=276970 WS=512"
"121","3.811976000","10.0.0.1","10.0.0.2","TCP","74","irdmi > 34466 [SYN, ACK] Seq=0 Ack=1 Win=28960 Len=0 MSS=1460 SACK_PERM=1 TSval=276996 TSecr=276970 WS=512"
"122","3.825874000","10.0.0.1","10.0.0.2","TCP","66","irdmi > 34456 [ACK] Seq=346 Ack=612 Win=32256 Len=0 TSval=277000 TSecr=276974"
"123","3.826803000","10.0.0.1","10.0.0.2","TCP","74","irdmi > 34468 [SYN, ACK] Seq=0 Ack=1 Win=28960 Len=0 MSS=1460 SACK_PERM=1 TSval=277000 TSecr=276975 WS=512"
"124","3.960058000","10.0.0.2","10.0.0.1","TCP","66","34462 > irdmi [ACK] Seq=1 Ack=1 Win=29696 Len=0 TSval=277021 TSecr=276995"
"125","3.960059000","10.0.0.2","10.0.0.1","HTTP","698","GET /Course%20Outlines%20-%20Electrical%20and%20Computer%20Engineering%20-%20Faculty%20of%20Engineering%20-%20Western%20University_files/tab-closed.gif HTTP/1.1 "
"126","3.960060000","10.0.0.2","10.0.0.1","TCP","66","34460 > irdmi [ACK] Seq=1 Ack=1 Win=29696 Len=0 TSval=277021 TSecr=276995"
"127","3.960061000","10.0.0.2","10.0.0.1","HTTP","720","GET /Course%20Outlines%20-%20Electrical%20and%20Computer%20Engineering%20-%20Faculty%20of%20Engineering%20-%20Western%20University_files/Western_Logo_F_S_Engineering_RGB.svg HTTP/1.1 "
"128","3.960976000","10.0.0.2","10.0.0.1","TCP","66","34464 > irdmi [ACK] Seq=1 Ack=1 Win=29696 Len=0 TSval=277021 TSecr=276996"
"129","3.960977000","10.0.0.2","10.0.0.1","HTTP","653","GET /Course%20Outlines%20-%20Electrical%20and%20Computer%20Engineering%20-%20Faculty%20of%20Engineering%20-%20Western%20University_files/f.txt HTTP/1.1 "
"130","3.965507000","10.0.0.2","10.0.0.1","TCP","66","34458 > irdmi [ACK] Seq=1 Ack=1 Win=29696 Len=0 TSval=277021 TSecr=276996"
"131","3.966110000","10.0.0.2","10.0.0.1","HTTP","687","GET /Course%20Outlines%20-%20Electrical%20and%20Computer%20Engineering%20-%20Faculty%20of%20Engineering%20-%20Western%20University_files/jquery-ui-1.8.21.custom.min.js.download HTTP/1.1 "
"132","3.971526000","10.0.0.2","10.0.0.1","TCP","66","34466 > irdmi [ACK] Seq=1 Ack=1 Win=29696 Len=0 TSval=277022 TSecr=276996"
"133","3.972080000","10.0.0.2","10.0.0.1","HTTP","672","GET /Course%20Outlines%20-%20Electrical%20and%20Computer%20Engineering%20-%20Faculty%20of%20Engineering%20-%20Western%20University_files/jquery.tweet.js.download HTTP/1.1 "
"134","3.978661000","10.0.0.2","10.0.0.1","TCP","66","34468 > irdmi [ACK] Seq=1 Ack=1 Win=29696 Len=0 TSval=277025 TSecr=277000"
"135","3.978662000","10.0.0.2","10.0.0.1","HTTP","676","GET /Course%20Outlines%20-%20Electrical%20and%20Computer%20Engineering%20-%20Faculty%20of%20Engineering%20-%20Western%20University_files/SpryTabbedPanels.js.download HTTP/1.1 "
"136","4.010267000","10.0.0.1","10.0.0.2","TCP","66","irdmi > 34462 [ACK] Seq=1 Ack=633 Win=32256 Len=0 TSval=277046 TSecr=277021"
"137","4.010272000","10.0.0.1","10.0.0.2","TCP","66","irdmi > 34460 [ACK] Seq=1 Ack=655 Win=32256 Len=0 TSval=277046 TSecr=277021"
"138","4.011083000","10.0.0.1","10.0.0.2","TCP","66","irdmi > 34464 [ACK] Seq=1 Ack=588 Win=30208 Len=0 TSval=277046 TSecr=277021"
"139","4.011086000","10.0.0.1","10.0.0.2","TCP","95","[TCP segment of a reassembled PDU]"
"140","4.011248000","10.0.0.1","10.0.0.2","HTTP","381","HTTP/1.0 404 File not found  (text/html)"
"141","4.011846000","10.0.0.1","10.0.0.2","TCP","95","[TCP segment of a reassembled PDU]"
"142","4.011848000","10.0.0.1","10.0.0.2","HTTP","381","HTTP/1.0 404 File not found  (text/html)"
"143","4.012089000","10.0.0.1","10.0.0.2","TCP","95","[TCP segment of a reassembled PDU]"
"144","4.012092000","10.0.0.1","10.0.0.2","HTTP","381","HTTP/1.0 404 File not found  (text/html)"
"145","4.016271000","10.0.0.1","10.0.0.2","TCP","66","irdmi > 34458 [ACK] Seq=1 Ack=622 Win=32256 Len=0 TSval=277047 TSecr=277021"
"146","4.016642000","10.0.0.1","10.0.0.2","TCP","95","[TCP segment of a reassembled PDU]"
"147","4.016645000","10.0.0.1","10.0.0.2","HTTP","381","HTTP/1.0 404 File not found  (text/html)"
"148","4.022475000","10.0.0.1","10.0.0.2","TCP","66","irdmi > 34466 [ACK] Seq=1 Ack=607 Win=32256 Len=0 TSval=277049 TSecr=277022"
"149","4.022479000","10.0.0.1","10.0.0.2","TCP","95","[TCP segment of a reassembled PDU]"
"150","4.023015000","10.0.0.1","10.0.0.2","HTTP","381","HTTP/1.0 404 File not found  (text/html)"
"151","4.028880000","10.0.0.1","10.0.0.2","TCP","66","irdmi > 34468 [ACK] Seq=1 Ack=611 Win=32256 Len=0 TSval=277050 TSecr=277025"
"152","4.029812000","10.0.0.1","10.0.0.2","TCP","95","[TCP segment of a reassembled PDU]"
"153","4.029816000","10.0.0.1","10.0.0.2","HTTP","381","HTTP/1.0 404 File not found  (text/html)"
"154","4.162121000","10.0.0.2","10.0.0.1","TCP","66","34462 > irdmi [ACK] Seq=633 Ack=30 Win=29696 Len=0 TSval=277071 TSecr=277046"
"155","4.162588000","10.0.0.2","10.0.0.1","TCP","66","34460 > irdmi [ACK] Seq=655 Ack=30 Win=29696 Len=0 TSval=277071 TSecr=277046"
"156","4.163576000","10.0.0.2","10.0.0.1","TCP","66","34462 > irdmi [FIN, ACK] Seq=633 Ack=346 Win=32256 Len=0 TSval=277071 TSecr=277046"
"157","4.163587000","10.0.0.2","10.0.0.1","TCP","66","34464 > irdmi [ACK] Seq=588 Ack=30 Win=29696 Len=0 TSval=277072 TSecr=277046"
"158","4.164542000","10.0.0.2","10.0.0.1","TCP","74","34470 > irdmi [SYN] Seq=0 Win=29200 Len=0 MSS=1460 SACK_PERM=1 TSval=277071 TSecr=0 WS=512"
"159","4.164543000","10.0.0.2","10.0.0.1","TCP","66","34460 > irdmi [FIN, ACK] Seq=655 Ack=346 Win=32256 Len=0 TSval=277072 TSecr=277046"
"160","4.165540000","10.0.0.2","10.0.0.1","TCP","74","34472 > irdmi [SYN] Seq=0 Win=29200 Len=0 MSS=1460 SACK_PERM=1 TSval=277072 TSecr=0 WS=512"
"161","4.167509000","10.0.0.2","10.0.0.1","TCP","66","34458 > irdmi [ACK] Seq=622 Ack=30 Win=29696 Len=0 TSval=277073 TSecr=277047"
"162","4.168479000","10.0.0.2","10.0.0.1","TCP","66","34464 > irdmi [FIN, ACK] Seq=588 Ack=346 Win=32256 Len=0 TSval=277073 TSecr=277046"
"163","4.173633000","10.0.0.2","10.0.0.1","TCP","66","34458 > irdmi [FIN, ACK] Seq=622 Ack=346 Win=32256 Len=0 TSval=277074 TSecr=277047"
"164","4.174386000","10.0.0.2","10.0.0.1","TCP","66","34466 > irdmi [ACK] Seq=607 Ack=30 Win=29696 Len=0 TSval=277074 TSecr=277049"
"165","4.178239000","10.0.0.2","10.0.0.1","TCP","66","34466 > irdmi [FIN, ACK] Seq=607 Ack=346 Win=32256 Len=0 TSval=277075 TSecr=277049"
"166","4.181149000","10.0.0.2","10.0.0.1","TCP","66","34468 > irdmi [ACK] Seq=611 Ack=30 Win=29696 Len=0 TSval=277076 TSecr=277051"
"167","4.187010000","10.0.0.2","10.0.0.1","TCP","66","34468 > irdmi [FIN, ACK] Seq=611 Ack=346 Win=32256 Len=0 TSval=277077 TSecr=277051"
"168","4.194859000","10.0.0.2","10.0.0.1","TCP","74","34476 > irdmi [SYN] Seq=0 Win=29200 Len=0 MSS=1460 SACK_PERM=1 TSval=277079 TSecr=0 WS=512"
"169","4.195496000","10.0.0.2","10.0.0.1","TCP","74","34474 > irdmi [SYN] Seq=0 Win=29200 Len=0 MSS=1460 SACK_PERM=1 TSval=277079 TSecr=0 WS=512"
"170","4.195764000","10.0.0.2","10.0.0.1","TCP","74","34478 > irdmi [SYN] Seq=0 Win=29200 Len=0 MSS=1460 SACK_PERM=1 TSval=277079 TSecr=0 WS=512"
"171","4.196456000","10.0.0.2","10.0.0.1","TCP","74","34480 > irdmi [SYN] Seq=0 Win=29200 Len=0 MSS=1460 SACK_PERM=1 TSval=277079 TSecr=0 WS=512"
"172","4.213764000","10.0.0.1","10.0.0.2","TCP","66","irdmi > 34462 [ACK] Seq=346 Ack=634 Win=32256 Len=0 TSval=277097 TSecr=277071"
"173","4.214903000","10.0.0.1","10.0.0.2","TCP","74","irdmi > 34470 [SYN, ACK] Seq=0 Ack=1 Win=28960 Len=0 MSS=1460 SACK_PERM=1 TSval=277097 TSecr=277071 WS=512"
"174","4.214909000","10.0.0.1","10.0.0.2","TCP","66","irdmi > 34460 [ACK] Seq=346 Ack=656 Win=32256 Len=0 TSval=277097 TSecr=277072"
"175","4.215803000","10.0.0.1","10.0.0.2","TCP","74","irdmi > 34472 [SYN, ACK] Seq=0 Ack=1 Win=28960 Len=0 MSS=1460 SACK_PERM=1 TSval=277097 TSecr=277072 WS=512"
"176","4.218551000","10.0.0.1","10.0.0.2","TCP","66","irdmi > 34464 [ACK] Seq=346 Ack=589 Win=30208 Len=0 TSval=277098 TSecr=277073"
"177","4.224044000","10.0.0.1","10.0.0.2","TCP","66","irdmi > 34458 [ACK] Seq=346 Ack=623 Win=32256 Len=0 TSval=277099 TSecr=277074"
"178","4.228324000","10.0.0.1","10.0.0.2","TCP","66","irdmi > 34466 [ACK] Seq=346 Ack=608 Win=32256 Len=0 TSval=277100 TSecr=277075"
"179","4.237404000","10.0.0.1","10.0.0.2","TCP","66","irdmi > 34468 [ACK] Seq=346 Ack=612 Win=32256 Len=0 TSval=277103 TSecr=277077"
"180","4.245140000","10.0.0.1","10.0.0.2","TCP","74","irdmi > 34476 [SYN, ACK] Seq=0 Ack=1 Win=28960 Len=0 MSS=1460 SACK_PERM=1 TSval=277105 TSecr=277079 WS=512"
"181","4.246061000","10.0.0.1","10.0.0.2","TCP","74","irdmi > 34474 [SYN, ACK] Seq=0 Ack=1 Win=28960 Len=0 MSS=1460 SACK_PERM=1 TSval=277105 TSecr=277079 WS=512"
"182","4.246064000","10.0.0.1","10.0.0.2","TCP","74","irdmi > 34478 [SYN, ACK] Seq=0 Ack=1 Win=28960 Len=0 MSS=1460 SACK_PERM=1 TSval=277105 TSecr=277079 WS=512"
"183","4.246542000","10.0.0.1","10.0.0.2","TCP","74","irdmi > 34480 [SYN, ACK] Seq=0 Ack=1 Win=28960 Len=0 MSS=1460 SACK_PERM=1 TSval=277105 TSecr=277079 WS=512"
"184","4.366676000","10.0.0.2","10.0.0.1","TCP","66","34470 > irdmi [ACK] Seq=1 Ack=1 Win=29696 Len=0 TSval=277122 TSecr=277097"
"185","4.366677000","10.0.0.2","10.0.0.1","HTTP","676","GET /Course%20Outlines%20-%20Electrical%20and%20Computer%20Engineering%20-%20Faculty%20of%20Engineering%20-%20Western%20University_files/1.6.4.jquery.min.js.download HTTP/1.1 "
"186","4.367623000","10.0.0.2","10.0.0.1","TCP","66","34472 > irdmi [ACK] Seq=1 Ack=1 Win=29696 Len=0 TSval=277123 TSecr=277097"
"187","4.367643000","10.0.0.2","10.0.0.1","HTTP","667","GET /Course%20Outlines%20-%20Electrical%20and%20Computer%20Engineering%20-%20Faculty%20of%20Engineering%20-%20Western%20University_files/facebox.js.download HTTP/1.1 "
"188","4.399848000","10.0.0.2","10.0.0.1","TCP","66","34476 > irdmi [ACK] Seq=1 Ack=1 Win=29696 Len=0 TSval=277130 TSecr=277105"
"189","4.399849000","10.0.0.2","10.0.0.1","HTTP","677","GET /Course%20Outlines%20-%20Electrical%20and%20Computer%20Engineering%20-%20Faculty%20of%20Engineering%20-%20Western%20University_files/jquery.flexslider.js.download HTTP/1.1 "
"190","4.399850000","10.0.0.2","10.0.0.1","TCP","66","34474 > irdmi [ACK] Seq=1 Ack=1 Win=29696 Len=0 TSval=277130 TSecr=277105"
"191","4.399851000","10.0.0.2","10.0.0.1","HTTP","673","GET /Course%20Outlines%20-%20Electrical%20and%20Computer%20Engineering%20-%20Faculty%20of%20Engineering%20-%20Western%20University_files/jquery.client.js.download HTTP/1.1 "
"192","4.399852000","10.0.0.2","10.0.0.1","TCP","66","34478 > irdmi [ACK] Seq=1 Ack=1 Win=29696 Len=0 TSval=277130 TSecr=277105"
"193","4.399854000","10.0.0.2","10.0.0.1","HTTP","687","GET /Course%20Outlines%20-%20Electrical%20and%20Computer%20Engineering%20-%20Faculty%20of%20Engineering%20-%20Western%20University_files/jquery.hoverIntent.minified.js.download HTTP/1.1 "
"194","4.405038000","10.0.0.2","10.0.0.1","TCP","66","34480 > irdmi [ACK] Seq=1 Ack=1 Win=29696 Len=0 TSval=277130 TSecr=277105"
"195","4.405499000","10.0.0.2","10.0.0.1","HTTP","678","GET /Course%20Outlines%20-%20Electrical%20and%20Computer%20Engineering%20-%20Faculty%20of%20Engineering%20-%20Western%20University_files/scripts-responsive.js.download HTTP/1.1 "
"196","4.416931000","10.0.0.1","10.0.0.2","TCP","66","irdmi > 34470 [ACK] Seq=1 Ack=611 Win=32256 Len=0 TSval=277147 TSecr=277122"
"197","4.418012000","10.0.0.1","10.0.0.2","TCP","95","[TCP segment of a reassembled PDU]"
"198","4.418061000","10.0.0.1","10.0.0.2","TCP","66","irdmi > 34472 [ACK] Seq=1 Ack=602 Win=30208 Len=0 TSval=277148 TSecr=277123"
"199","4.418081000","10.0.0.1","10.0.0.2","HTTP","381","HTTP/1.0 404 File not found  (text/html)"
"200","4.418442000","10.0.0.1","10.0.0.2","TCP","95","[TCP segment of a reassembled PDU]"
"201","4.418445000","10.0.0.1","10.0.0.2","HTTP","381","HTTP/1.0 404 File not found  (text/html)"
"202","4.449948000","10.0.0.1","10.0.0.2","TCP","66","irdmi > 34476 [ACK] Seq=1 Ack=612 Win=32256 Len=0 TSval=277156 TSecr=277130"
"203","4.449953000","10.0.0.1","10.0.0.2","TCP","66","irdmi > 34474 [ACK] Seq=1 Ack=608 Win=30208 Len=0 TSval=277156 TSecr=277130"
"204","4.449955000","10.0.0.1","10.0.0.2","TCP","66","irdmi > 34478 [ACK] Seq=1 Ack=622 Win=32256 Len=0 TSval=277156 TSecr=277130"
"205","4.450448000","10.0.0.1","10.0.0.2","TCP","95","[TCP segment of a reassembled PDU]"
"206","4.450451000","10.0.0.1","10.0.0.2","HTTP","381","HTTP/1.0 404 File not found  (text/html)"
"207","4.450926000","10.0.0.1","10.0.0.2","TCP","95","[TCP segment of a reassembled PDU]"
"208","4.450992000","10.0.0.1","10.0.0.2","HTTP","381","HTTP/1.0 404 File not found  (text/html)"
"209","4.451461000","10.0.0.1","10.0.0.2","TCP","95","[TCP segment of a reassembled PDU]"
"210","4.451464000","10.0.0.1","10.0.0.2","HTTP","381","HTTP/1.0 404 File not found  (text/html)"
"211","4.455975000","10.0.0.1","10.0.0.2","TCP","66","irdmi > 34480 [ACK] Seq=1 Ack=613 Win=32256 Len=0 TSval=277157 TSecr=277130"
"212","4.456955000","10.0.0.1","10.0.0.2","TCP","95","[TCP segment of a reassembled PDU]"
"213","4.456958000","10.0.0.1","10.0.0.2","HTTP","381","HTTP/1.0 404 File not found  (text/html)"
"214","4.569029000","10.0.0.2","10.0.0.1","TCP","66","34470 > irdmi [ACK] Seq=611 Ack=30 Win=29696 Len=0 TSval=277173 TSecr=277147"
"215","4.569548000","10.0.0.2","10.0.0.1","TCP","66","34472 > irdmi [ACK] Seq=602 Ack=30 Win=29696 Len=0 TSval=277173 TSecr=277148"
"216","4.570511000","10.0.0.2","10.0.0.1","TCP","66","34470 > irdmi [FIN, ACK] Seq=611 Ack=346 Win=32256 Len=0 TSval=277173 TSecr=277148"
"217","4.571119000","10.0.0.2","10.0.0.1","TCP","74","34482 > irdmi [SYN] Seq=0 Win=29200 Len=0 MSS=1460 SACK_PERM=1 TSval=277173 TSecr=0 WS=512"
"218","4.572251000","10.0.0.2","10.0.0.1","TCP","66","34472 > irdmi [FIN, ACK] Seq=602 Ack=346 Win=32256 Len=0 TSval=277174 TSecr=277148"
"219","4.575065000","10.0.0.2","10.0.0.1","TCP","74","34484 > irdmi [SYN] Seq=0 Win=29200 Len=0 MSS=1460 SACK_PERM=1 TSval=277174 TSecr=0 WS=512"
"220","4.600887000","10.0.0.2","10.0.0.1","TCP","66","34476 > irdmi [ACK] Seq=612 Ack=30 Win=29696 Len=0 TSval=277181 TSecr=277156"
"221","4.601764000","10.0.0.2","10.0.0.1","TCP","66","34474 > irdmi [ACK] Seq=608 Ack=30 Win=29696 Len=0 TSval=277181 TSecr=277156"
"222","4.602181000","10.0.0.2","10.0.0.1","TCP","66","34476 > irdmi [FIN, ACK] Seq=612 Ack=346 Win=32256 Len=0 TSval=277181 TSecr=277156"
"223","4.602182000","10.0.0.2","10.0.0.1","TCP","66","34478 > irdmi [ACK] Seq=622 Ack=30 Win=29696 Len=0 TSval=277181 TSecr=277156"
"224","4.602744000","10.0.0.2","10.0.0.1","TCP","74","34486 > irdmi [SYN] Seq=0 Win=29200 Len=0 MSS=1460 SACK_PERM=1 TSval=277181 TSecr=0 WS=512"
"225","4.603437000","10.0.0.2","10.0.0.1","TCP","66","34474 > irdmi [FIN, ACK] Seq=608 Ack=346 Win=32256 Len=0 TSval=277182 TSecr=277156"
"226","4.604927000","10.0.0.2","10.0.0.1","TCP","66","34478 > irdmi [FIN, ACK] Seq=622 Ack=346 Win=32256 Len=0 TSval=277182 TSecr=277156"
"227","4.607654000","10.0.0.2","10.0.0.1","TCP","74","34488 > irdmi [SYN] Seq=0 Win=29200 Len=0 MSS=1460 SACK_PERM=1 TSval=277182 TSecr=0 WS=512"
"228","4.607767000","10.0.0.2","10.0.0.1","TCP","66","34480 > irdmi [ACK] Seq=613 Ack=30 Win=29696 Len=0 TSval=277183 TSecr=277157"
"229","4.608336000","10.0.0.2","10.0.0.1","TCP","74","34490 > irdmi [SYN] Seq=0 Win=29200 Len=0 MSS=1460 SACK_PERM=1 TSval=277182 TSecr=0 WS=512"
"230","4.610307000","10.0.0.2","10.0.0.1","TCP","66","34480 > irdmi [FIN, ACK] Seq=613 Ack=346 Win=32256 Len=0 TSval=277183 TSecr=277157"
"231","4.612581000","10.0.0.2","10.0.0.1","TCP","74","34492 > irdmi [SYN] Seq=0 Win=29200 Len=0 MSS=1460 SACK_PERM=1 TSval=277184 TSecr=0 WS=512"
"232","4.620602000","10.0.0.1","10.0.0.2","TCP","66","irdmi > 34470 [ACK] Seq=346 Ack=612 Win=32256 Len=0 TSval=277198 TSecr=277173"
"233","4.621168000","10.0.0.1","10.0.0.2","TCP","74","irdmi > 34482 [SYN, ACK] Seq=0 Ack=1 Win=28960 Len=0 MSS=1460 SACK_PERM=1 TSval=277199 TSecr=277173 WS=512"
"234","4.622328000","10.0.0.1","10.0.0.2","TCP","66","irdmi > 34472 [ACK] Seq=346 Ack=603 Win=30208 Len=0 TSval=277199 TSecr=277174"
"235","4.625261000","10.0.0.1","10.0.0.2","TCP","74","irdmi > 34484 [SYN, ACK] Seq=0 Ack=1 Win=28960 Len=0 MSS=1460 SACK_PERM=1 TSval=277200 TSecr=277174 WS=512"
"236","4.652666000","10.0.0.1","10.0.0.2","TCP","66","irdmi > 34476 [ACK] Seq=346 Ack=613 Win=32256 Len=0 TSval=277206 TSecr=277181"
"237","4.652893000","10.0.0.1","10.0.0.2","TCP","74","irdmi > 34486 [SYN, ACK] Seq=0 Ack=1 Win=28960 Len=0 MSS=1460 SACK_PERM=1 TSval=277207 TSecr=277181 WS=512"
"238","4.653508000","10.0.0.1","10.0.0.2","TCP","66","irdmi > 34474 [ACK] Seq=346 Ack=609 Win=30208 Len=0 TSval=277207 TSecr=277182"
"239","4.654947000","10.0.0.1","10.0.0.2","TCP","66","irdmi > 34478 [ACK] Seq=346 Ack=623 Win=32256 Len=0 TSval=277207 TSecr=277182"
"240","4.657721000","10.0.0.1","10.0.0.2","TCP","74","irdmi > 34488 [SYN, ACK] Seq=0 Ack=1 Win=28960 Len=0 MSS=1460 SACK_PERM=1 TSval=277208 TSecr=277182 WS=512"
"241","4.658390000","10.0.0.1","10.0.0.2","TCP","74","irdmi > 34490 [SYN, ACK] Seq=0 Ack=1 Win=28960 Len=0 MSS=1460 SACK_PERM=1 TSval=277208 TSecr=277182 WS=512"
"242","4.660341000","10.0.0.1","10.0.0.2","TCP","66","irdmi > 34480 [ACK] Seq=346 Ack=614 Win=32256 Len=0 TSval=277208 TSecr=277183"
"243","4.663300000","10.0.0.1","10.0.0.2","TCP","74","irdmi > 34492 [SYN, ACK] Seq=0 Ack=1 Win=28960 Len=0 MSS=1460 SACK_PERM=1 TSval=277209 TSecr=277184 WS=512"
"244","4.772745000","10.0.0.2","10.0.0.1","TCP","66","34482 > irdmi [ACK] Seq=1 Ack=1 Win=29696 Len=0 TSval=277224 TSecr=277199"
"245","4.772747000","10.0.0.2","10.0.0.1","HTTP","687","GET /Course%20Outlines%20-%20Electrical%20and%20Computer%20Engineering%20-%20Faculty%20of%20Engineering%20-%20Western%20University_files/jquery-ui-1.8.21.custom.min.js.download HTTP/1.1 "
"246","4.776123000","10.0.0.2","10.0.0.1","TCP","66","34484 > irdmi [ACK] Seq=1 Ack=1 Win=29696 Len=0 TSval=277225 TSecr=277200"
"247","4.776319000","10.0.0.2","10.0.0.1","HTTP","675","GET /Course%20Outlines%20-%20Electrical%20and%20Computer%20Engineering%20-%20Faculty%20of%20Engineering%20-%20Western%20University_files/jquery.validate.js.download HTTP/1.1 "
"248","4.804995000","10.0.0.2","10.0.0.1","TCP","66","34486 > irdmi [ACK] Seq=1 Ack=1 Win=29696 Len=0 TSval=277232 TSecr=277207"
"249","4.804998000","10.0.0.2","10.0.0.1","HTTP","681","GET /Course%20Outlines%20-%20Electrical%20and%20Computer%20Engineering%20-%20Faculty%20of%20Engineering%20-%20Western%20University_files/datepicker.validation.js.download HTTP/1.1 "
"250","4.809522000","10.0.0.2","10.0.0.1","TCP","66","34488 > irdmi [ACK] Seq=1 Ack=1 Win=29696 Len=0 TSval=277233 TSecr=277208"
"251","4.809776000","10.0.0.2","10.0.0.1","HTTP","683","GET /Course%20Outlines%20-%20Electrical%20and%20Computer%20Engineering%20-%20Faculty%20of%20Engineering%20-%20Western%20University_files/jquery.ui.addresspicker.js.download HTTP/1.1 "
"252","4.810384000","10.0.0.2","10.0.0.1","TCP","66","34490 > irdmi [ACK] Seq=1 Ack=1 Win=29696 Len=0 TSval=277233 TSecr=277208"
"253","4.810385000","10.0.0.2","10.0.0.1","HTTP","680","GET /Course%20Outlines%20-%20Electrical%20and%20Computer%20Engineering%20-%20Faculty%20of%20Engineering%20-%20Western%20University_files/jquery.ui.timepicker.js.download HTTP/1.1 "
"254","4.815420000","10.0.0.2","10.0.0.1","TCP","66","34492 > irdmi [ACK] Seq=1 Ack=1 Win=29696 Len=0 TSval=277234 TSecr=277209"
"255","4.815434000","10.0.0.2","10.0.0.1","HTTP","662","GET /Course%20Outlines%20-%20Electrical%20and%20Computer%20Engineering%20-%20Faculty%20of%20Engineering%20-%20Western%20University_files/ga.js.download HTTP/1.1 "
"256","4.822849000","10.0.0.1","10.0.0.2","TCP","66","irdmi > 34482 [ACK] Seq=1 Ack=622 Win=32256 Len=0 TSval=277249 TSecr=277224"
"257","4.824406000","10.0.0.1","10.0.0.2","TCP","95","[TCP segment of a reassembled PDU]"
"258","4.824410000","10.0.0.1","10.0.0.2","HTTP","381","HTTP/1.0 404 File not found  (text/html)"
"259","4.826358000","10.0.0.1","10.0.0.2","TCP","66","irdmi > 34484 [ACK] Seq=1 Ack=610 Win=32256 Len=0 TSval=277250 TSecr=277225"
"260","4.826810000","10.0.0.1","10.0.0.2","TCP","95","[TCP segment of a reassembled PDU]"
"261","4.826933000","10.0.0.1","10.0.0.2","HTTP","381","HTTP/1.0 404 File not found  (text/html)"
"262","4.855158000","10.0.0.1","10.0.0.2","TCP","66","irdmi > 34486 [ACK] Seq=1 Ack=616 Win=32256 Len=0 TSval=277257 TSecr=277232"
"263","4.856365000","10.0.0.1","10.0.0.2","TCP","95","[TCP segment of a reassembled PDU]"
"264","4.856368000","10.0.0.1","10.0.0.2","HTTP","381","HTTP/1.0 404 File not found  (text/html)"
"265","4.859829000","10.0.0.1","10.0.0.2","TCP","66","irdmi > 34488 [ACK] Seq=1 Ack=618 Win=32256 Len=0 TSval=277258 TSecr=277233"
"266","4.860228000","10.0.0.1","10.0.0.2","TCP","95","[TCP segment of a reassembled PDU]"
"267","4.860337000","10.0.0.1","10.0.0.2","HTTP","381","HTTP/1.0 404 File not found  (text/html)"
"268","4.860427000","10.0.0.1","10.0.0.2","TCP","66","irdmi > 34490 [ACK] Seq=1 Ack=615 Win=32256 Len=0 TSval=277258 TSecr=277233"
"269","4.860812000","10.0.0.1","10.0.0.2","TCP","95","[TCP segment of a reassembled PDU]"
"270","4.860921000","10.0.0.1","10.0.0.2","HTTP","381","HTTP/1.0 404 File not found  (text/html)"
"271","4.865554000","10.0.0.1","10.0.0.2","TCP","66","irdmi > 34492 [ACK] Seq=1 Ack=597 Win=30208 Len=0 TSval=277260 TSecr=277234"
"272","4.866829000","10.0.0.1","10.0.0.2","TCP","95","[TCP segment of a reassembled PDU]"
"273","4.866973000","10.0.0.1","10.0.0.2","HTTP","381","HTTP/1.0 404 File not found  (text/html)"
"274","4.975533000","10.0.0.2","10.0.0.1","TCP","66","34482 > irdmi [ACK] Seq=622 Ack=30 Win=29696 Len=0 TSval=277275 TSecr=277249"
"275","4.977440000","10.0.0.2","10.0.0.1","TCP","66","34482 > irdmi [FIN, ACK] Seq=622 Ack=346 Win=32256 Len=0 TSval=277275 TSecr=277249"
"276","4.977442000","10.0.0.2","10.0.0.1","TCP","66","34484 > irdmi [ACK] Seq=610 Ack=30 Win=29696 Len=0 TSval=277275 TSecr=277250"
"277","4.978847000","10.0.0.2","10.0.0.1","TCP","66","34484 > irdmi [FIN, ACK] Seq=610 Ack=346 Win=32256 Len=0 TSval=277275 TSecr=277250"
"278","4.984593000","10.0.0.2","10.0.0.1","TCP","74","34494 > irdmi [SYN] Seq=0 Win=29200 Len=0 MSS=1460 SACK_PERM=1 TSval=277276 TSecr=0 WS=512"
"279","4.986598000","10.0.0.2","10.0.0.1","TCP","74","34496 > irdmi [SYN] Seq=0 Win=29200 Len=0 MSS=1460 SACK_PERM=1 TSval=277276 TSecr=0 WS=512"
"280","5.006945000","10.0.0.2","10.0.0.1","TCP","66","34486 > irdmi [ACK] Seq=616 Ack=30 Win=29696 Len=0 TSval=277282 TSecr=277257"
"281","5.007751000","10.0.0.2","10.0.0.1","TCP","66","34486 > irdmi [FIN, ACK] Seq=616 Ack=346 Win=32256 Len=0 TSval=277283 TSecr=277257"
"282","5.009384000","10.0.0.2","10.0.0.1","TCP","74","34498 > irdmi [SYN] Seq=0 Win=29200 Len=0 MSS=1460 SACK_PERM=1 TSval=277283 TSecr=0 WS=512"
"283","5.011268000","10.0.0.2","10.0.0.1","TCP","66","34488 > irdmi [ACK] Seq=618 Ack=30 Win=29696 Len=0 TSval=277283 TSecr=277258"
"284","5.012050000","10.0.0.2","10.0.0.1","TCP","66","34490 > irdmi [ACK] Seq=615 Ack=30 Win=29696 Len=0 TSval=277284 TSecr=277258"
"285","5.012051000","10.0.0.2","10.0.0.1","TCP","66","34488 > irdmi [FIN, ACK] Seq=618 Ack=346 Win=32256 Len=0 TSval=277284 TSecr=277258"
"286","5.013256000","10.0.0.2","10.0.0.1","TCP","66","34490 > irdmi [FIN, ACK] Seq=615 Ack=346 Win=32256 Len=0 TSval=277284 TSecr=277258"
"287","5.017420000","10.0.0.2","10.0.0.1","TCP","66","34492 > irdmi [ACK] Seq=597 Ack=30 Win=29696 Len=0 TSval=277285 TSecr=277260"
"288","5.019147000","10.0.0.2","10.0.0.1","TCP","66","34492 > irdmi [FIN, ACK] Seq=597 Ack=346 Win=32256 Len=0 TSval=277285 TSecr=277260"
"289","5.027529000","10.0.0.1","10.0.0.2","TCP","66","irdmi > 34482 [ACK] Seq=346 Ack=623 Win=32256 Len=0 TSval=277300 TSecr=277275"
"290","5.028884000","10.0.0.1","10.0.0.2","TCP","66","irdmi > 34484 [ACK] Seq=346 Ack=611 Win=32256 Len=0 TSval=277301 TSecr=277275"
"291","5.034750000","10.0.0.1","10.0.0.2","TCP","74","irdmi > 34494 [SYN, ACK] Seq=0 Ack=1 Win=28960 Len=0 MSS=1460 SACK_PERM=1 TSval=277302 TSecr=277276 WS=512"
"292","5.037119000","10.0.0.1","10.0.0.2","TCP","74","irdmi > 34496 [SYN, ACK] Seq=0 Ack=1 Win=28960 Len=0 MSS=1460 SACK_PERM=1 TSval=277302 TSecr=277276 WS=512"
"293","5.057804000","10.0.0.1","10.0.0.2","TCP","66","irdmi > 34486 [ACK] Seq=346 Ack=617 Win=32256 Len=0 TSval=277308 TSecr=277283"
"294","5.059429000","10.0.0.1","10.0.0.2","TCP","74","irdmi > 34498 [SYN, ACK] Seq=0 Ack=1 Win=28960 Len=0 MSS=1460 SACK_PERM=1 TSval=277308 TSecr=277283 WS=512"
"295","5.062118000","10.0.0.1","10.0.0.2","TCP","66","irdmi > 34488 [ACK] Seq=346 Ack=619 Win=32256 Len=0 TSval=277309 TSecr=277284"
"296","5.063299000","10.0.0.1","10.0.0.2","TCP","66","irdmi > 34490 [ACK] Seq=346 Ack=616 Win=32256 Len=0 TSval=277309 TSecr=277284"
"297","5.069918000","10.0.0.1","10.0.0.2","TCP","66","irdmi > 34492 [ACK] Seq=346 Ack=598 Win=30208 Len=0 TSval=277311 TSecr=277285"
